{
  "$schema": "../module.schema.json",
  "name": "audio",
  "description": "SFX and music playback: one-shot sounds, loops, and interruptible sources via one AudioSystem",
  "dependencies": [
    "foundation"
  ],
  "platforms": ["desktop", "web"],
  "nugetDependencies": [
    {
      "id": "nkast.Xna.Framework.Audio",
      "version": "4.2.9001",
      "platforms": ["web"]
    }
  ],
  "csprojProperties": {},
  "mgcbEntries": [],
  "postInstallNotes": "## audio installed\n\n**Runtime wiring.** Create one `ContentAudioPlayer` per screen and register the single `AudioSystem` in your update pipeline (position does not matter — it only talks to the audio backend):\n```csharp\nvar audioPlayer = new ContentAudioPlayer(content);\npipeline.Add(new AudioSystem(world, audioPlayer));\n```\nDispose the player with the screen (after the pipeline) to release live instances.\n\n**One-shot SFX** (button click, hit feedback) — publish a message, no entity needed:\n```csharp\nworld.Publish(new PlaySoundRequest(\"Sounds/click\", volume: 0.8f));\n```\n\n**Lifecycle playback** (looping ambience, interruptible music) — put an `AudioSourceComponent` on an entity:\n```csharp\nentity.Set(new AudioSourceComponent(\"Sounds/wind\", loop: true));\n// cut it: entity.Get<AudioSourceComponent>().State = AudioPlaybackState.Stopped;\n// or remove the component / dispose the entity — playback stops immediately.\n```\n\n**Content.** Add `.wav` (or `.ogg`) files to your `.mgcb` with the built-in importer — no extra `/reference:` lines needed:\n```\n#begin Sounds/click.wav\n/importer:WavImporter\n/processor:SoundEffectProcessor\n/build:Sounds/click.wav\n```\n\n**Edit-capable screens?** Register the system with `EditTimeBehavior.Freeze` — audio is game logic. Freeze stops *reconciliation*, not already-live instances (a loop keeps sounding in Edit); see `docs/premises.md`.\n\n**No audio hardware?** `ContentAudioPlayer` degrades to a silent no-op (single warning log) so headless/CI runs keep working.\n\n**Web (KNI/BlazorGL)?** Browsers keep the AudioContext suspended until the first user gesture — KNI does not resume it itself. The shared MonoDreams web host layer (`MonoDreams.Web.Hosting/wwwroot/js/host.js`) resumes it automatically on the first pointerdown/keydown; a standalone (CLI-scaffolded) web head must replicate that hook or web audio stays muted. See `docs/web-targeting.md` (Audio section).\n\n**Premises:** `docs/premises.md`",
  "premisesRef": "docs/premises.md",
  "demo": {
    "entry": "MonoDreams.Demo.Audio.AudioDemoScreen",
    "description": "One-shot click SFX, a toggleable looping wind ambience, and a jukebox riff you can cut mid-play - all mixing simultaneously. A short frame-scripted boot sequence plays each case once and logs every start/stop (the headless observable).",
    "dependencies": ["rendering-text", "ui", "cursor"]
  }
}
