{
  "$schema": "../module.schema.json",
  "name": "foundation",
  "description": "Required base: ECS world, screen controller, hierarchy/transform, input, replay, logger",
  "dependencies": [],
  "platforms": ["desktop", "web"],
  "nugetDependencies": [
    {
      "id": "MonoGame.Framework.DesktopGL",
      "version": "3.8.4",
      "platforms": ["desktop"]
    },
    {
      "id": "nkast.Xna.Framework",
      "version": "4.2.9001",
      "platforms": ["web"]
    },
    {
      "id": "nkast.Xna.Framework.Content",
      "version": "4.2.9001",
      "platforms": ["web"]
    },
    {
      "id": "nkast.Xna.Framework.Graphics",
      "version": "4.2.9001",
      "platforms": ["web"]
    },
    {
      "id": "nkast.Xna.Framework.Input",
      "version": "4.2.9001",
      "platforms": ["web"]
    },
    {
      "id": "DefaultEcs",
      "version": "0.18.0-beta01"
    }
  ],
  "csprojProperties": {},
  "mgcbEntries": [],
  "postInstallNotes": "## foundation installed\n\nYour project now has the MonoDreams base: an ECS world, screen controller, transform/hierarchy systems, input abstraction, replay, the structured logger, and the opt-in `WindowFit` windowing helper.\n\nWiring checklist:\n1. Initialize the logger early \u2014 in your `Game` constructor, before anything that logs: `Logger.Initialize(\"debug\");` writes to `debug/monodreams_*.log`. Set the `MONODREAMS_DEBUG_DIR` env var to redirect output (the test runner uses this for parallel isolation).\n2. Build a `ScreenController` and a starting `IGameScreen`. See `MonoDreams.Examples/Screens/` for full examples.\n3. The `HierarchySystem` must run AFTER any system that mutates transforms and BEFORE any system that reads world-space transforms (rendering, collision).\n4. `TransformCommitSystem` runs end-of-frame to flip `Delta` into the current-frame buffer \u2014 your physics/render systems should read `TransformComponent.WorldPosition`, not `LocalPosition`, downstream.\n5. Desktop window sizing: use `WindowFit.Apply(_graphics, VirtualWidth, VirtualHeight, Window);` in your head's constructor INSTEAD of setting `PreferredBackBufferWidth/Height`. A fixed window larger than the player's display is not clamped by macOS, so pinning the backbuffer to the render resolution silently renders the bottom of your game offscreen on smaller laptops. It logs one boot line (render/display/usable/window/mode); `MONODREAMS_WINDOW=WxH` forces an exact size for scripted runs. Keep the call on the desktop side of your platform gate \u2014 on web the host page owns the canvas size.\n\n**Premises:** `docs/premises.md`",
  "premisesRef": "docs/premises.md"
}
