{
  "$schema": "../module.schema.json",
  "name": "ui",
  "description": "Flexbox-style layout, builders, slots, and interactive button primitives",
  "dependencies": [
    "foundation",
    "rendering"
  ],
  "platforms": ["desktop", "web"],
  "nugetDependencies": [],
  "csprojProperties": {},
  "mgcbEntries": [],
  "postInstallNotes": "## ui installed\n\nDeclarative flexbox-ish layout with builders. Compose UI like this:\n```csharp\nvar layout = new AutoLayoutBuilder(world, viewportManager);\nlayout.CreateRoot(ScreenAnchor.Center)\n    .Direction(LayoutDirection.Vertical)\n    .Gap(40)\n    .AddSlot(slot => slot.Attach(titleEntity).MeasureWith(MeasureText))\n    .AddSlot(slot => slot.Attach(button1).MeasureWith(_ => button1Size))\n    .Build();\n```\n\nRoots created with `CreateRoot` share one implicit solver container and STACK. For several independent panels, pin each one at its own position:\n```csharp\nlayout.CreatePinnedRoot(new Vector2(32, 32))            // from the top-left\n    .AddSlot(...)\n    .Build();\nlayout.CreatePinnedRoot(Vector2.Zero, ScreenAnchor.BottomCenter)\n    .AddSlot(...)\n    .Build();\n```\n\nPipeline order (UI lives in the screen's update path):\n1. `IntrinsicSizingSystem` \u2014 measure content via callbacks.\n2. `AutoLayoutSystem` \u2014 compute and apply positions.\n3. `PinnedLayoutRootSystem` \u2014 place pinned roots. Must run AFTER `AutoLayoutSystem` and BEFORE `HierarchySystem` / any world-position consumer.\n4. Your interaction systems (hover, click).\n5. `ButtonMeshPrepSystem` \u2014 paint button outlines via `IMeshGenerator` (the mesh primitives ship in `rendering`).\n6. `LayoutDebugSystem` \u2014 optional outline visualization (toggle `LayoutDebugSystem.Enabled`).\n\n**Note:** `ButtonInteractionSystem` is **not** in this module \u2014 it's game-specific (it dispatches to your selected screen/scene). Copy the pattern from `MonoDreams.Examples/System/UI/ButtonInteractionSystem.cs`.",
  "premisesRef": "docs/premises.md"
}
